{"schema":2,"generated":"2026-10-31","run":"daily","source":"Atlas (its own files: sources/, platforms/, links.json)","sources":{"gog":{"files":1,"records":8383,"bytes":8448894,"generated":"2026-10-30"},"msstore":{"files":2,"records":8007,"bytes":5436360,"generated":"2026-10-30"},"nlib-ctr":{"files":2,"records":4368,"bytes":1041371,"generated":"2026-10-30"},"steam-store":{"files":6,"records":110665,"bytes":53969902,"generated":"2026-10-30"},"steamspy":{"files":1,"records":509,"bytes":39236,"generated":"2026-10-30"},"titledb":{"files":5,"records":108463,"bytes":51003143,"generated":"2026-10-30"},"wikidata":{"files":20,"records":513009,"bytes":63970433,"generated":"2026-10-31"},"wikipedia":{"files":2,"records":6308,"bytes":680674,"generated":"2026-10-31"}},"platforms":{"3do":{"games":163,"names":163,"popular":156,"linked":0.166,"reviewed":0.0,"generated":"2026-10-30"},"3ds":{"games":2198,"names":2198,"popular":363,"linked":0.046,"reviewed":0.0,"generated":"2026-10-30"},"amiga":{"games":1831,"names":1818,"popular":1614,"linked":0.101,"reviewed":0.0,"generated":"2026-10-30"},"amstradcpc":{"games":1295,"names":1169,"popular":1078,"linked":0.046,"reviewed":0.0,"generated":"2026-10-30"},"apple2":{"games":239,"names":239,"popular":219,"linked":0.021,"reviewed":0.0,"generated":"2026-10-30"},"arcade":{"games":1980,"names":1972,"popular":1854,"linked":0.067,"reviewed":0.0,"generated":"2026-10-30"},"atari2600":{"games":409,"names":408,"popular":395,"linked":0.015,"reviewed":0.0,"generated":"2026-10-30"},"atarist":{"games":1118,"names":1115,"popular":1036,"linked":0.092,"reviewed":0.0,"generated":"2026-10-30"},"c64":{"games":2858,"names":2804,"popular":2524,"linked":0.044,"reviewed":0.0,"generated":"2026-10-30"},"cdi":{"games":110,"names":104,"popular":85,"linked":0.136,"reviewed":0.0,"generated":"2026-10-30"},"colecovision":{"games":131,"names":131,"popular":99,"linked":0.023,"reviewed":0.0,"generated":"2026-10-30"},"dos":{"games":302,"names":297,"popular":235,"linked":0.142,"reviewed":0.0,"generated":"2026-10-30"},"dreamcast":{"games":500,"names":493,"popular":470,"linked":0.134,"reviewed":0.0,"generated":"2026-10-30"},"fds":{"games":189,"names":181,"popular":147,"linked":0.011,"reviewed":0.0,"generated":"2026-10-30"},"gamecube":{"games":685,"names":685,"popular":669,"linked":0.105,"reviewed":0.0,"generated":"2026-10-30"},"gamegear":{"games":184,"names":181,"popular":163,"linked":0.071,"reviewed":0.0,"generated":"2026-10-30"},"gb":{"games":556,"names":541,"popular":488,"linked":0.04,"reviewed":0.0,"generated":"2026-10-30"},"gba":{"games":1065,"names":1052,"popular":960,"linked":0.054,"reviewed":0.0,"generated":"2026-10-30"},"gbc":{"games":468,"names":465,"popular":388,"linked":0.051,"reviewed":0.0,"generated":"2026-10-30"},"genesis":{"games":1031,"names":1031,"popular":989,"linked":0.127,"reviewed":0.0,"generated":"2026-10-30"},"gog":{"games":8383,"names":8383,"popular":6809,"linked":0.0,"reviewed":0.806,"generated":"2026-10-30"},"msx":{"games":633,"names":599,"popular":566,"linked":0.039,"reviewed":0.0,"generated":"2026-10-30"},"n64":{"games":416,"names":416,"popular":405,"linked":0.082,"reviewed":0.0,"generated":"2026-10-30"},"nds":{"games":1840,"names":1685,"popular":1645,"linked":0.1,"reviewed":0.0,"generated":"2026-10-30"},"neogeo":{"games":122,"names":122,"popular":122,"linked":0.23,"reviewed":0.0,"generated":"2026-10-30"},"nes":{"games":1214,"names":1210,"popular":1159,"linked":0.048,"reviewed":0.0,"generated":"2026-10-30"},"ps1":{"games":2244,"names":2213,"popular":1865,"linked":0.097,"reviewed":0.0,"generated":"2026-10-30"},"ps2":{"games":3155,"names":3029,"popular":2959,"linked":0.115,"reviewed":0.0,"generated":"2026-10-30"},"ps3":{"games":2010,"names":1992,"popular":1903,"linked":0.478,"reviewed":0.0,"generated":"2026-10-30"},"psp":{"games":1271,"names":1252,"popular":1159,"linked":0.22,"reviewed":0.0,"generated":"2026-10-30"},"psv":{"games":933,"names":927,"popular":793,"linked":0.559,"reviewed":0.0,"generated":"2026-10-30"},"saturn":{"games":552,"names":539,"popular":506,"linked":0.078,"reviewed":0.0,"generated":"2026-10-30"},"segacd":{"games":167,"names":160,"popular":166,"linked":0.084,"reviewed":0.0,"generated":"2026-10-30"},"sms":{"games":267,"names":267,"popular":243,"linked":0.079,"reviewed":0.0,"generated":"2026-10-30"},"snes":{"games":1426,"names":1426,"popular":1336,"linked":0.048,"reviewed":0.0,"generated":"2026-10-30"},"steam":{"games":41322,"names":41321,"popular":85602,"linked":0.123,"reviewed":0.46,"generated":"2026-10-30"},"switch":{"games":2563,"names":23956,"popular":2493,"linked":0.901,"reviewed":0.854,"generated":"2026-10-30"},"turbografx16":{"games":357,"names":354,"popular":320,"linked":0.084,"reviewed":0.0,"generated":"2026-10-30"},"wii":{"games":1659,"names":1657,"popular":1342,"linked":0.166,"reviewed":0.0,"generated":"2026-10-30"},"wiiu":{"games":868,"names":864,"popular":565,"linked":0.412,"reviewed":0.0,"generated":"2026-10-30"},"xbox":{"games":6664,"names":6664,"popular":6644,"linked":0.874,"reviewed":0.982,"generated":"2026-10-30"},"xbox-og":{"games":1036,"names":1031,"popular":985,"linked":0.204,"reviewed":0.0,"generated":"2026-10-30"},"xbox360":{"games":1824,"names":1823,"popular":1733,"linked":0.484,"reviewed":0.0,"generated":"2026-10-30"},"zxspectrum":{"games":1688,"names":1643,"popular":1578,"linked":0.046,"reviewed":0.0,"generated":"2026-10-30"}},"steps":{"collect wikidata daily":55.1,"collect wikipedia daily":1528.2,"trends":0.2}}
